[
  {
    "id": "11111111-1111-1111-1111-111111111111",
    "title": "Regulators signal agent-identity rules for autonomous AI",
    "url": "https://example.com/agent-identity-rules",
    "source": "Example Wire",
    "published_at": "2026-06-13T09:00:00Z",
    "summary": "A policy body signals forthcoming disclosure rules for autonomous AI agents.",
    "topics": ["ai-policy", "agentic-ai", "identity"],
    "trending_score": 72,
    "is_active": true,
    "is_stale": false
  },
  {
    "id": "22222222-2222-2222-2222-222222222222",
    "title": "New multi-agent framework ships native MCP support",
    "url": "https://example.com/multi-agent-mcp",
    "source": "Dev Daily",
    "published_at": "2026-06-12T14:30:00Z",
    "summary": "An open-source agentic AI framework adds Model Context Protocol support for tool use.",
    "topics": ["agentic-ai", "mcp", "developers"],
    "trending_score": 88,
    "is_active": true,
    "is_stale": false
  },
  {
    "id": "33333333-3333-3333-3333-333333333333",
    "title": "Enterprises demand verifiable trust for AI agents",
    "url": "https://example.com/verifiable-trust-agents",
    "source": "Enterprise Times",
    "published_at": "2026-06-11T08:15:00Z",
    "summary": "Large enterprises push for verifiable identity and trust controls before deploying AI agents.",
    "topics": ["ai-trust", "identity", "enterprise"],
    "trending_score": 65,
    "is_active": true,
    "is_stale": false
  },
  {
    "id": "44444444-4444-4444-4444-444444444444",
    "title": "Startup launches platform for autonomous AI agents",
    "url": "https://example.com/autonomous-agents-platform",
    "source": "Startup News",
    "published_at": "2026-06-10T17:45:00Z",
    "summary": "A startup debuts a platform to build and run autonomous AI agents at scale.",
    "topics": ["agentic-ai", "startups"],
    "trending_score": 40,
    "is_active": true,
    "is_stale": false
  },
  {
    "id": "55555555-5555-5555-5555-555555555555",
    "title": "EU AI Act enforcement deadline approaches for agentic systems",
    "url": "https://example.com/eu-ai-act-agentic",
    "source": "Policy Watch",
    "published_at": "2026-06-09T11:00:00Z",
    "summary": "Compliance deadlines under the EU AI Act loom for providers of agentic AI systems.",
    "topics": ["ai-policy", "regulation", "eu"],
    "trending_score": 55,
    "is_active": true,
    "is_stale": false
  },
  {
    "id": "66666666-6666-6666-6666-666666666666",
    "title": "Regulators signal agent identity rules for autonomous AI systems",
    "url": "https://other.example.com/agent-identity-rules-dup",
    "source": "Second Source",
    "published_at": "2026-06-13T10:30:00Z",
    "summary": "Coverage of the same forthcoming disclosure rules for autonomous AI agents from a second outlet.",
    "topics": ["ai-policy", "agentic-ai", "identity"],
    "trending_score": 60,
    "is_active": true,
    "is_stale": false
  }
]
